{
  "schema_version": 1,
  "case_id": "get-attack",
  "fixture_sha256": "2689367b205c16ce32ed4200942b8b8b1e262dfc70d9bc9fbc77c49699a4f1df",
  "reference": {
    "profile": "native-go-default-build",
    "go_commit": "d9cc9befc2721fd217ce1660a0e91aca1157221d",
    "rust_commit": "e078282328dce075ad8b421bf052aa1f7190c6ec"
  },
  "connection": {
    "remote_addr": "203.0.113.7",
    "remote_port": 50000,
    "local_addr": "192.0.2.10",
    "local_port": 8080,
    "tls": false,
    "tls_version": null
  },
  "request": {
    "method": "GET",
    "uri": {
      "base64": "L3NlYXJjaD9xPWF0dGFjaw=="
    },
    "protocol": "HTTP/1.1",
    "headers": [
      {
        "name": "Host",
        "value": {
          "base64": "ZXhhbXBsZS5pbnZhbGlk"
        }
      },
      {
        "name": "X-Forwarded-For",
        "value": {
          "base64": "MTk4LjUxLjEwMC45"
        }
      },
      {
        "name": "X-Forwarded-For",
        "value": {
          "base64": "MTk4LjUxLjEwMC4xMA=="
        }
      }
    ],
    "body": {
      "base64": ""
    },
    "chunks": []
  },
  "response": {
    "status": 200,
    "protocol": "HTTP/1.1",
    "headers": [
      {
        "name": "Content-Type",
        "value": {
          "base64": "dGV4dC9wbGFpbg=="
        }
      }
    ],
    "body": {
      "base64": "b2s="
    },
    "chunks": [
      {
        "offset": 0,
        "length": 2
      }
    ]
  },
  "processor": {
    "sec_lang": {
      "utf8": "SecRuleEngine On\nSecRequestBodyAccess On\nSecRule ARGS_GET:q \"@contains attack\" \"id:1001,phase:2,deny,status:403,log\"\n"
    },
    "request_body_processor": "auto",
    "response_body_processor": "auto",
    "config": {}
  },
  "phase_calls": [
    {
      "call": "process_connection",
      "phase": 1
    },
    {
      "call": "process_uri",
      "phase": 1
    },
    {
      "call": "process_request_headers",
      "phase": 1
    },
    {
      "call": "process_request_body",
      "phase": 2
    },
    {
      "call": "process_response_headers",
      "phase": 3
    },
    {
      "call": "append_response_body",
      "phase": 4,
      "chunk_index": 0
    },
    {
      "call": "process_response_body",
      "phase": 4
    },
    {
      "call": "process_logging",
      "phase": 5
    }
  ],
  "expected": {
    "matches": [
      {
        "rule_id": 1001,
        "phase": 2,
        "variable": "ARGS_GET",
        "key": "q",
        "value": {
          "base64": "YXR0YWNr"
        }
      }
    ],
    "interruptions": [
      {
        "rule_id": 1001,
        "action": "deny",
        "status": 403,
        "data": {
          "base64": ""
        }
      }
    ],
    "captures": [],
    "scores": {},
    "flags": {
      "REQBODY_ERROR": "0"
    },
    "collections": [],
    "audit": {
      "required": false,
      "parts": "",
      "entries": 0
    }
  },
  "normalize": [
    "timestamps",
    "generated_ids",
    "temporary_paths",
    "audit_boundaries"
  ]
}
